{"$schema":"https://json-schema.org/draft/2020-12/schema","$id":"https://simplevtt.local/schemas/rule-module.schema.json","title":"SimpleVTT RuleModule","type":"object","required":["schemaVersion","moduleId","moduleVersion","rulesProfile","defaultLocale","source","capabilities","content"],"properties":{"schemaVersion":{"const":"0.1-draft"},"moduleId":{"type":"string","pattern":"^[a-z0-9][a-z0-9._-]*$"},"moduleVersion":{"type":"string","minLength":1},"rulesProfile":{"type":"object","required":["id","version"],"properties":{"id":{"type":"string","minLength":1},"version":{"type":"string","minLength":1}},"additionalProperties":false},"defaultLocale":{"type":"string","pattern":"^[a-z]{2}(?:-[A-Z]{2})?$"},"source":{"$ref":"#/$defs/source"},"localizationSource":{"$ref":"#/$defs/localizationSource"},"dependencies":{"type":"array","items":{"$ref":"#/$defs/moduleRef"}},"conflicts":{"type":"array","items":{"$ref":"#/$defs/moduleRef"}},"capabilities":{"type":"array","uniqueItems":true,"items":{"type":"string","minLength":1}},"extensionPoints":{"type":"array","items":{"type":"object","required":["id","acceptsCategories"],"properties":{"id":{"type":"string","minLength":1},"acceptsCategories":{"type":"array","minItems":1,"uniqueItems":true,"items":{"type":"string","minLength":1}}},"additionalProperties":false}},"content":{"type":"array","items":{"$ref":"https://simplevtt.local/schemas/content-entry.schema.json"}},"$schema":{"type":"string","format":"uri"}},"additionalProperties":false,"$defs":{"moduleRef":{"type":"object","required":["moduleId","version"],"properties":{"moduleId":{"type":"string","minLength":1},"version":{"type":"string","minLength":1}},"additionalProperties":false},"source":{"type":"object","required":["document","version","license","srdDerived"],"properties":{"document":{"type":"string","minLength":1},"version":{"type":"string","minLength":1},"license":{"type":"string","minLength":1},"srdDerived":{"type":"boolean"},"urls":{"type":"array","items":{"type":"string","format":"uri"}},"attributionNotice":{"type":"string"}},"additionalProperties":false},"localizationSource":{"type":"object","required":["defaultLocale","repository","srdPathRoot","distributionBoundary"],"properties":{"defaultLocale":{"type":"string"},"repository":{"type":"string","minLength":1},"srdPathRoot":{"type":"string","minLength":1},"glossaryPathRoot":{"type":"string","minLength":1},"distributionBoundary":{"enum":["srd-only"]}},"additionalProperties":false}}}
