{"$schema":"https://simplevtt.local/schemas/rule-module.schema.json","schemaVersion":"0.1-draft","moduleId":"dnd.srd-5.2.1.equipment-packs","moduleVersion":"0.1-draft","rulesProfile":{"id":"dnd.srd-5.2.1","version":"0.1-draft"},"defaultLocale":"ko-KR","source":{"document":"System Reference Document","version":"5.2.1","license":"CC-BY-4.0","srdDerived":true},"localizationSource":{"defaultLocale":"ko-KR","repository":"Kaetaeru/D-D-2024-","srdPathRoot":"10-RULEBOOKS/srd-5.2.1/equipment/adventuring-gear.md","distributionBoundary":"srd-only"},"dependencies":[{"moduleId":"dnd.srd-5.2.1.core","version":"0.1-draft"}],"conflicts":[],"capabilities":[],"extensionPoints":[],"content":[{"id":"dnd.srd521.item.pack.burglar","category":"adventuring-gear","presentation":{"originalName":"Burglar's Pack","defaultLocale":"ko-KR","locales":{"ko-KR":{"name":"도둑 꾸러미"}}},"mechanics":[{"kind":"pack-definition","config":{"weightLb":42,"priceGp":16}}]},{"id":"dnd.srd521.item.pack.diplomat","category":"adventuring-gear","presentation":{"originalName":"Diplomat's Pack","defaultLocale":"ko-KR","locales":{"ko-KR":{"name":"외교관 꾸러미"}}},"mechanics":[{"kind":"pack-definition","config":{"weightLb":39,"priceGp":39}}]},{"id":"dnd.srd521.item.pack.dungeoneer","category":"adventuring-gear","presentation":{"originalName":"Dungeoneer's Pack","defaultLocale":"ko-KR","locales":{"ko-KR":{"name":"던전 탐험가 꾸러미"}}},"mechanics":[{"kind":"pack-definition","config":{"weightLb":55,"priceGp":12}}]},{"id":"dnd.srd521.item.pack.entertainer","category":"adventuring-gear","presentation":{"originalName":"Entertainer's Pack","defaultLocale":"ko-KR","locales":{"ko-KR":{"name":"공연자 꾸러미"}}},"mechanics":[{"kind":"pack-definition","config":{"weightLb":58.5,"priceGp":40}}]},{"id":"dnd.srd521.item.pack.explorer","category":"adventuring-gear","presentation":{"originalName":"Explorer's Pack","defaultLocale":"ko-KR","locales":{"ko-KR":{"name":"탐험가 꾸러미"}}},"mechanics":[{"kind":"pack-definition","config":{"weightLb":55,"priceGp":10}}]},{"id":"dnd.srd521.item.pack.priest","category":"adventuring-gear","presentation":{"originalName":"Priest's Pack","defaultLocale":"ko-KR","locales":{"ko-KR":{"name":"사제 꾸러미"}}},"mechanics":[{"kind":"pack-definition","config":{"weightLb":29,"priceGp":33}}]},{"id":"dnd.srd521.item.pack.scholar","category":"adventuring-gear","presentation":{"originalName":"Scholar's Pack","defaultLocale":"ko-KR","locales":{"ko-KR":{"name":"학자 꾸러미"}}},"mechanics":[{"kind":"pack-definition","config":{"weightLb":22,"priceGp":40}}]}]}