{"$schema":"https://simplevtt.local/schemas/rule-module.schema.json","schemaVersion":"0.1-draft","moduleId":"dnd.srd-5.2.1.spells-a-animate-objects","moduleVersion":"0.1-draft","rulesProfile":{"id":"dnd.srd-5.2.1","version":"0.1-draft"},"defaultLocale":"ko-KR","source":{"document":"System Reference Document","version":"5.2.1","license":"CC-BY-4.0","srdDerived":true},"dependencies":[{"moduleId":"dnd.srd-5.2.1.core","version":"0.1-draft"}],"conflicts":[],"capabilities":[],"extensionPoints":[],"content":[{"id":"dnd.srd521.spell.animate-objects","category":"spell","presentation":{"originalName":"Animate Objects","defaultLocale":"ko-KR","locales":{"ko-KR":{"name":"물체 조종"}}},"mechanics":[{"kind":"spell-definition","config":{"level":5,"school":"transmutation","ritual":false,"castingTimeText":"행동","rangeText":"120피트","componentsText":"V, S","durationText":"집중, 최대 1분","supportStatus":"presentation-only","sourcePath":"10-RULEBOOKS/srd-5.2.1/spells/a.md"}}]}]}