{"$schema":"https://simplevtt.local/schemas/rule-module.schema.json","schemaVersion":"0.1-draft","moduleId":"dnd.srd-5.2.1.equipment-books","moduleVersion":"0.1-draft","rulesProfile":{"id":"dnd.srd-5.2.1","version":"0.1-draft"},"defaultLocale":"ko-KR","source":{"document":"System Reference Document","version":"5.2.1","license":"CC-BY-4.0","srdDerived":true},"dependencies":[{"moduleId":"dnd.srd-5.2.1.core","version":"0.1-draft"}],"conflicts":[],"capabilities":[],"extensionPoints":[],"content":[{"id":"dnd.srd521.item.gear.book","category":"adventuring-gear","presentation":{"originalName":"Book","defaultLocale":"ko-KR","locales":{"ko-KR":{"name":"책"}}},"mechanics":[{"kind":"item-definition","config":{"weightLb":5,"priceGp":25,"variants":["prayer-book","history-book","occult-lore-book"],"variantNames":{"prayer-book":"기도서","history-book":"역사서","occult-lore-book":"비술서"}}}]},{"id":"dnd.srd521.item.gear.spellbook","category":"adventuring-gear","presentation":{"originalName":"Spellbook","defaultLocale":"ko-KR","locales":{"ko-KR":{"name":"주문서"}}},"mechanics":[{"kind":"item-definition","config":{"role":"wizard-spellbook"}}]}]}