{"$schema":"https://simplevtt.local/schemas/rule-module.schema.json","schemaVersion":"0.1-draft","moduleId":"dnd.srd-5.2.1.starting-loadout-sorcerer","moduleVersion":"0.1-draft","rulesProfile":{"id":"dnd.srd-5.2.1","version":"0.1-draft"},"defaultLocale":"ko-KR","source":{"document":"System Reference Document","version":"5.2.1","license":"CC-BY-4.0","srdDerived":true},"dependencies":[{"moduleId":"dnd.srd-5.2.1.core","version":"0.1-draft"},{"moduleId":"dnd.srd-5.2.1.classes","version":"0.1-draft"}],"conflicts":[],"capabilities":[],"extensionPoints":[],"content":[{"id":"dnd.srd521.loadout.class.sorcerer","category":"starting-loadout","presentation":{"originalName":"Sorcerer Starting Equipment","defaultLocale":"ko-KR","locales":{"ko-KR":{"name":"소서러 시작 장비"}}},"mechanics":[{"kind":"starting-loadout-definition","config":{"ownerContentId":"dnd.srd521.class.sorcerer","options":[{"id":"A","items":[{"itemId":"dnd.srd521.item.weapon.spear","quantity":1},{"itemId":"dnd.srd521.item.weapon.dagger","quantity":2},{"itemId":"dnd.srd521.item.focus.arcane-crystal","quantity":1},{"itemId":"dnd.srd521.item.pack.dungeoneer","quantity":1}],"gp":28},{"id":"B","startingGoldGp":50}]}}]}]}