{"$schema":"https://simplevtt.local/schemas/rule-module.schema.json","schemaVersion":"0.1-draft","moduleId":"dnd.srd-5.2.1.starting-loadout-rogue","moduleVersion":"0.1-draft","rulesProfile":{"id":"dnd.srd-5.2.1","version":"0.1-draft"},"defaultLocale":"ko-KR","source":{"document":"System Reference Document","version":"5.2.1","license":"CC-BY-4.0","srdDerived":true},"dependencies":[{"moduleId":"dnd.srd-5.2.1.core","version":"0.1-draft"},{"moduleId":"dnd.srd-5.2.1.classes","version":"0.1-draft"}],"conflicts":[],"capabilities":[],"extensionPoints":[],"content":[{"id":"dnd.srd521.loadout.class.rogue","category":"starting-loadout","presentation":{"originalName":"Rogue Starting Equipment","defaultLocale":"ko-KR","locales":{"ko-KR":{"name":"로그 시작 장비"}}},"mechanics":[{"kind":"starting-loadout-definition","config":{"ownerContentId":"dnd.srd521.class.rogue","options":[{"id":"A","items":[{"itemId":"dnd.srd521.item.armor.leather","quantity":1},{"itemId":"dnd.srd521.item.weapon.dagger","quantity":2},{"itemId":"dnd.srd521.item.weapon.shortsword","quantity":1},{"itemId":"dnd.srd521.item.weapon.shortbow","quantity":1},{"itemId":"dnd.srd521.item.ammunition.arrows","quantity":1},{"itemId":"dnd.srd521.item.gear.quiver","quantity":1},{"itemId":"dnd.srd521.item.tool.thieves-tools","quantity":1},{"itemId":"dnd.srd521.item.pack.burglar","quantity":1}],"gp":8},{"id":"B","startingGoldGp":100}]}}]}]}