{"$schema":"https://simplevtt.local/schemas/rule-module.schema.json","schemaVersion":"0.1-draft","moduleId":"dnd.srd-5.2.1.spells-a-antipathy-eye","moduleVersion":"0.1-draft","rulesProfile":{"id":"dnd.srd-5.2.1","version":"0.1-draft"},"defaultLocale":"ko-KR","source":{"document":"System Reference Document","version":"5.2.1","license":"CC-BY-4.0","srdDerived":true},"dependencies":[{"moduleId":"dnd.srd-5.2.1.core","version":"0.1-draft"}],"conflicts":[],"capabilities":[],"extensionPoints":[],"content":[{"id":"dnd.srd521.spell.antipathy-sympathy","category":"spell","presentation":{"originalName":"Antipathy/Sympathy","defaultLocale":"ko-KR","locales":{"ko-KR":{"name":"반감/공감"}}},"mechanics":[{"kind":"spell-definition","config":{"level":8,"school":"enchantment","ritual":false,"castingTimeText":"1시간","rangeText":"60피트","componentsText":"V, S, M (식초와 꿀을 섞은 것)","durationText":"10일","supportStatus":"presentation-only","sourcePath":"10-RULEBOOKS/srd-5.2.1/spells/a.md"}}]},{"id":"dnd.srd521.spell.arcane-eye","category":"spell","presentation":{"originalName":"Arcane Eye","defaultLocale":"ko-KR","locales":{"ko-KR":{"name":"비전의 눈"}}},"mechanics":[{"kind":"spell-definition","config":{"level":4,"school":"divination","ritual":false,"castingTimeText":"행동","rangeText":"30피트","componentsText":"V, S, M (박쥐 털 약간)","durationText":"집중, 최대 1시간","supportStatus":"presentation-only","sourcePath":"10-RULEBOOKS/srd-5.2.1/spells/a.md"}}]}]}