{"$schema":"https://simplevtt.local/schemas/rule-module.schema.json","schemaVersion":"0.1-draft","moduleId":"dnd.srd-5.2.1.starting-loadouts-backgrounds","moduleVersion":"0.1-draft","rulesProfile":{"id":"dnd.srd-5.2.1","version":"0.1-draft"},"defaultLocale":"ko-KR","source":{"document":"System Reference Document","version":"5.2.1","license":"CC-BY-4.0","srdDerived":true},"dependencies":[{"moduleId":"dnd.srd-5.2.1.core","version":"0.1-draft"},{"moduleId":"dnd.srd-5.2.1.origins","version":"0.1-draft"}],"conflicts":[],"capabilities":[],"extensionPoints":[],"content":[{"id":"dnd.srd521.loadout.background.acolyte","category":"starting-loadout","presentation":{"originalName":"Acolyte Starting Equipment","defaultLocale":"ko-KR","locales":{"ko-KR":{"name":"신앙 수행자 시작 장비"}}},"mechanics":[{"kind":"starting-loadout-definition","config":{"ownerContentId":"dnd.srd521.background.acolyte","options":[{"id":"A","items":[{"itemId":"dnd.srd521.item.tool.calligraphers-supplies","quantity":1},{"itemId":"dnd.srd521.item.gear.book","quantity":1},{"itemId":"dnd.srd521.item.gear.parchment","quantity":10},{"itemId":"dnd.srd521.item.gear.robe","quantity":1}],"itemVariants":{"dnd.srd521.item.gear.book":"prayer-book"},"choices":[{"kind":"choose-one","itemIds":["dnd.srd521.item.focus.holy-amulet","dnd.srd521.item.focus.holy-emblem","dnd.srd521.item.focus.holy-reliquary"]}],"gp":8},{"id":"B","startingGoldGp":50}]}}]},{"id":"dnd.srd521.loadout.background.criminal","category":"starting-loadout","presentation":{"originalName":"Criminal Starting Equipment","defaultLocale":"ko-KR","locales":{"ko-KR":{"name":"범죄자 시작 장비"}}},"mechanics":[{"kind":"starting-loadout-definition","config":{"ownerContentId":"dnd.srd521.background.criminal","options":[{"id":"A","items":[{"itemId":"dnd.srd521.item.weapon.dagger","quantity":2},{"itemId":"dnd.srd521.item.tool.thieves-tools","quantity":1},{"itemId":"dnd.srd521.item.gear.crowbar","quantity":1},{"itemId":"dnd.srd521.item.gear.pouch","quantity":2},{"itemId":"dnd.srd521.item.gear.traveler-clothes","quantity":1}],"gp":16},{"id":"B","startingGoldGp":50}]}}]},{"id":"dnd.srd521.loadout.background.sage","category":"starting-loadout","presentation":{"originalName":"Sage Starting Equipment","defaultLocale":"ko-KR","locales":{"ko-KR":{"name":"현자 시작 장비"}}},"mechanics":[{"kind":"starting-loadout-definition","config":{"ownerContentId":"dnd.srd521.background.sage","options":[{"id":"A","items":[{"itemId":"dnd.srd521.item.weapon.quarterstaff","quantity":1},{"itemId":"dnd.srd521.item.tool.calligraphers-supplies","quantity":1},{"itemId":"dnd.srd521.item.gear.book","quantity":1},{"itemId":"dnd.srd521.item.gear.parchment","quantity":8},{"itemId":"dnd.srd521.item.gear.robe","quantity":1}],"itemVariants":{"dnd.srd521.item.gear.book":"history-book"},"gp":8},{"id":"B","startingGoldGp":50}]}}]},{"id":"dnd.srd521.loadout.background.soldier","category":"starting-loadout","presentation":{"originalName":"Soldier Starting Equipment","defaultLocale":"ko-KR","locales":{"ko-KR":{"name":"군인 시작 장비"}}},"mechanics":[{"kind":"starting-loadout-definition","config":{"ownerContentId":"dnd.srd521.background.soldier","options":[{"id":"A","items":[{"itemId":"dnd.srd521.item.weapon.spear","quantity":1},{"itemId":"dnd.srd521.item.weapon.shortbow","quantity":1},{"itemId":"dnd.srd521.item.ammunition.arrows","quantity":1},{"itemId":"dnd.srd521.item.gear.quiver","quantity":1},{"itemId":"dnd.srd521.item.tool.gaming-set","quantity":1},{"itemId":"dnd.srd521.item.gear.healers-kit","quantity":1},{"itemId":"dnd.srd521.item.gear.traveler-clothes","quantity":1}],"gp":14},{"id":"B","startingGoldGp":50}]}}]}]}