{"$schema":"https://simplevtt.local/schemas/rule-module.schema.json","schemaVersion":"0.1-draft","moduleId":"dnd.srd-5.2.1.spells-a-arcane-sword-aura","moduleVersion":"0.1-draft","rulesProfile":{"id":"dnd.srd-5.2.1","version":"0.1-draft"},"defaultLocale":"ko-KR","source":{"document":"System Reference Document","version":"5.2.1","license":"CC-BY-4.0","srdDerived":true},"dependencies":[{"moduleId":"dnd.srd-5.2.1.core","version":"0.1-draft"}],"conflicts":[],"capabilities":["dnd.damage.typed.v1"],"extensionPoints":[],"content":[{"id":"dnd.srd521.spell.arcane-sword","category":"spell","presentation":{"originalName":"Arcane Sword","defaultLocale":"ko-KR","locales":{"ko-KR":{"name":"비전의 검"}}},"mechanics":[{"kind":"spell-definition","config":{"level":7,"school":"evocation","ritual":false,"castingTimeText":"행동","rangeText":"90피트","componentsText":"V, S, M (250 GP 이상의 소형 검 모형)","durationText":"집중, 최대 1분","supportStatus":"partial","sourcePath":"10-RULEBOOKS/srd-5.2.1/spells/a.md"}},{"kind":"persistent-spell-attack","config":{"mode":"melee","damage":"4d12 + spellcasting.mod","damageType":"force","repeatEconomy":"bonus-action","moveFeet":30}}]},{"id":"dnd.srd521.spell.arcanists-magic-aura","category":"spell","presentation":{"originalName":"Arcanist's Magic Aura","defaultLocale":"ko-KR","locales":{"ko-KR":{"name":"비전술사의 마법 오라"}}},"mechanics":[{"kind":"spell-definition","config":{"level":2,"school":"illusion","ritual":false,"castingTimeText":"행동","rangeText":"접촉","componentsText":"V, S, M (작은 비단 조각)","durationText":"24시간","supportStatus":"presentation-only","sourcePath":"10-RULEBOOKS/srd-5.2.1/spells/a.md"}}]}]}