{"$schema":"https://simplevtt.local/schemas/rule-module.schema.json","schemaVersion":"0.1-draft","moduleId":"dnd.srd-5.2.1.equipment-martial-ranged","moduleVersion":"0.1-draft","rulesProfile":{"id":"dnd.srd-5.2.1","version":"0.1-draft"},"defaultLocale":"ko-KR","source":{"document":"System Reference Document","version":"5.2.1","license":"CC-BY-4.0","srdDerived":true},"localizationSource":{"defaultLocale":"ko-KR","repository":"Kaetaeru/D-D-2024-","srdPathRoot":"10-RULEBOOKS/srd-5.2.1/equipment/","distributionBoundary":"srd-only"},"dependencies":[{"moduleId":"dnd.srd-5.2.1.core","version":"0.1-draft"}],"conflicts":[],"capabilities":["dnd.damage.typed.v1"],"extensionPoints":[],"content":[{"id":"dnd.srd521.item.weapon.blowgun","category":"weapon","presentation":{"originalName":"Blowgun","defaultLocale":"ko-KR","locales":{"ko-KR":{"name":"바람총"}}},"mechanics":[{"kind":"weapon-definition","config":{"training":"martial","mode":"ranged","damage":"1","damageType":"piercing","properties":["ammunition:25/100","loading"],"mastery":"vex"}}]},{"id":"dnd.srd521.item.weapon.hand-crossbow","category":"weapon","presentation":{"originalName":"Hand Crossbow","defaultLocale":"ko-KR","locales":{"ko-KR":{"name":"손쇠뇌"}}},"mechanics":[{"kind":"weapon-definition","config":{"training":"martial","mode":"ranged","damage":"1d6","damageType":"piercing","properties":["ammunition:30/120","light","loading"],"mastery":"vex"}}]},{"id":"dnd.srd521.item.weapon.heavy-crossbow","category":"weapon","presentation":{"originalName":"Heavy Crossbow","defaultLocale":"ko-KR","locales":{"ko-KR":{"name":"중쇠뇌"}}},"mechanics":[{"kind":"weapon-definition","config":{"training":"martial","mode":"ranged","damage":"1d10","damageType":"piercing","properties":["ammunition:100/400","heavy","loading","two-handed"],"mastery":"push"}}]},{"id":"dnd.srd521.item.weapon.longbow","category":"weapon","presentation":{"originalName":"Longbow","defaultLocale":"ko-KR","locales":{"ko-KR":{"name":"장궁"}}},"mechanics":[{"kind":"weapon-definition","config":{"training":"martial","mode":"ranged","damage":"1d8","damageType":"piercing","properties":["ammunition:150/600","heavy","two-handed"],"mastery":"slow"}}]},{"id":"dnd.srd521.item.weapon.musket","category":"weapon","presentation":{"originalName":"Musket","defaultLocale":"ko-KR","locales":{"ko-KR":{"name":"머스킷"}}},"mechanics":[{"kind":"weapon-definition","config":{"training":"martial","mode":"ranged","damage":"1d12","damageType":"piercing","properties":["ammunition:40/120","loading","two-handed"],"mastery":"slow"}}]},{"id":"dnd.srd521.item.weapon.pistol","category":"weapon","presentation":{"originalName":"Pistol","defaultLocale":"ko-KR","locales":{"ko-KR":{"name":"권총"}}},"mechanics":[{"kind":"weapon-definition","config":{"training":"martial","mode":"ranged","damage":"1d10","damageType":"piercing","properties":["ammunition:30/90","loading"],"mastery":"vex"}}]}]}