{"$schema":"https://simplevtt.local/schemas/rule-module.schema.json","schemaVersion":"0.1-draft","moduleId":"dnd.srd-5.2.1.spells-a-alarm-alter","moduleVersion":"0.1-draft","rulesProfile":{"id":"dnd.srd-5.2.1","version":"0.1-draft"},"defaultLocale":"ko-KR","source":{"document":"System Reference Document","version":"5.2.1","license":"CC-BY-4.0","srdDerived":true},"dependencies":[{"moduleId":"dnd.srd-5.2.1.core","version":"0.1-draft"}],"conflicts":[],"capabilities":[],"extensionPoints":[],"content":[{"id":"dnd.srd521.spell.alarm","category":"spell","presentation":{"originalName":"Alarm","defaultLocale":"ko-KR","locales":{"ko-KR":{"name":"경보"}}},"mechanics":[{"kind":"spell-definition","config":{"level":1,"school":"abjuration","ritual":true,"castingTimeText":"1분","rangeText":"30피트","componentsText":"V, S, M (종 하나와 은선)","durationText":"8시간","supportStatus":"presentation-only","sourcePath":"10-RULEBOOKS/srd-5.2.1/spells/a.md"}}]},{"id":"dnd.srd521.spell.alter-self","category":"spell","presentation":{"originalName":"Alter Self","defaultLocale":"ko-KR","locales":{"ko-KR":{"name":"자기 변형"}}},"mechanics":[{"kind":"spell-definition","config":{"level":2,"school":"transmutation","ritual":false,"castingTimeText":"행동","rangeText":"자신","componentsText":"V, S","durationText":"집중, 최대 1시간","supportStatus":"partial","sourcePath":"10-RULEBOOKS/srd-5.2.1/spells/a.md"}}]}]}