{"$schema":"https://simplevtt.local/schemas/rule-module.schema.json","schemaVersion":"0.1-draft","moduleId":"dnd.srd-5.2.1.spells-a-animate-dead","moduleVersion":"0.1-draft","rulesProfile":{"id":"dnd.srd-5.2.1","version":"0.1-draft"},"defaultLocale":"ko-KR","source":{"document":"System Reference Document","version":"5.2.1","license":"CC-BY-4.0","srdDerived":true},"dependencies":[{"moduleId":"dnd.srd-5.2.1.core","version":"0.1-draft"}],"conflicts":[],"capabilities":[],"extensionPoints":[],"content":[{"id":"dnd.srd521.spell.animate-dead","category":"spell","presentation":{"originalName":"Animate Dead","defaultLocale":"ko-KR","locales":{"ko-KR":{"name":"사체 조종"}}},"mechanics":[{"kind":"spell-definition","config":{"level":3,"school":"necromancy","ritual":false,"castingTimeText":"1분","rangeText":"10피트","componentsText":"V, S, M (피 한 방울, 살점 한 조각, 뼛가루 한 꼬집)","durationText":"즉시","supportStatus":"presentation-only","sourcePath":"10-RULEBOOKS/srd-5.2.1/spells/a.md"}}]}]}