{"$schema":"https://simplevtt.local/schemas/rule-module.schema.json","schemaVersion":"0.1-draft","moduleId":"dnd.srd-5.2.1.equipment-starting-utility","moduleVersion":"0.1-draft","rulesProfile":{"id":"dnd.srd-5.2.1","version":"0.1-draft"},"defaultLocale":"ko-KR","source":{"document":"System Reference Document","version":"5.2.1","license":"CC-BY-4.0","srdDerived":true},"dependencies":[{"moduleId":"dnd.srd-5.2.1.core","version":"0.1-draft"}],"conflicts":[],"capabilities":[],"extensionPoints":[],"content":[{"id":"dnd.srd521.item.gear.quiver","category":"adventuring-gear","presentation":{"originalName":"Quiver","defaultLocale":"ko-KR","locales":{"ko-KR":{"name":"화살통"}}},"mechanics":[{"kind":"item-definition","config":{"weightLb":1,"priceGp":1}}]},{"id":"dnd.srd521.item.gear.robe","category":"adventuring-gear","presentation":{"originalName":"Robe","defaultLocale":"ko-KR","locales":{"ko-KR":{"name":"로브"}}},"mechanics":[{"kind":"item-definition","config":{"weightLb":4,"priceGp":1}}]},{"id":"dnd.srd521.item.gear.traveler-clothes","category":"adventuring-gear","presentation":{"originalName":"Traveler's Clothes","defaultLocale":"ko-KR","locales":{"ko-KR":{"name":"여행자 옷"}}},"mechanics":[{"kind":"item-definition","config":{"weightLb":4,"priceGp":2}}]},{"id":"dnd.srd521.item.gear.parchment","category":"adventuring-gear","presentation":{"originalName":"Parchment","defaultLocale":"ko-KR","locales":{"ko-KR":{"name":"양피지"}}},"mechanics":[{"kind":"item-definition","config":{"priceGp":0.1}}]},{"id":"dnd.srd521.item.gear.crowbar","category":"adventuring-gear","presentation":{"originalName":"Crowbar","defaultLocale":"ko-KR","locales":{"ko-KR":{"name":"쇠지렛대"}}},"mechanics":[{"kind":"item-definition","config":{"weightLb":5,"priceGp":2}}]},{"id":"dnd.srd521.item.gear.pouch","category":"adventuring-gear","presentation":{"originalName":"Pouch","defaultLocale":"ko-KR","locales":{"ko-KR":{"name":"주머니"}}},"mechanics":[{"kind":"item-definition","config":{"weightLb":1,"priceGp":0.5}}]},{"id":"dnd.srd521.item.gear.healers-kit","category":"adventuring-gear","presentation":{"originalName":"Healer's Kit","defaultLocale":"ko-KR","locales":{"ko-KR":{"name":"치유사 도구"}}},"mechanics":[{"kind":"item-definition","config":{"weightLb":3,"priceGp":5}}]}]}