{"$schema":"https://simplevtt.local/schemas/rule-module.schema.json","schemaVersion":"0.1-draft","moduleId":"dnd.srd-5.2.1.equipment-rations","moduleVersion":"0.1-draft","rulesProfile":{"id":"dnd.srd-5.2.1","version":"0.1-draft"},"defaultLocale":"ko-KR","source":{"document":"System Reference Document","version":"5.2.1","license":"CC-BY-4.0","srdDerived":true},"localizationSource":{"defaultLocale":"ko-KR","repository":"Kaetaeru/D-D-2024-","srdPathRoot":"10-RULEBOOKS/srd-5.2.1/equipment/adventuring-gear.md","distributionBoundary":"srd-only"},"dependencies":[{"moduleId":"dnd.srd-5.2.1.core","version":"0.1-draft"}],"conflicts":[],"capabilities":["campaign.ration-source"],"extensionPoints":[],"content":[{"id":"dnd.srd521.item.gear.rations","category":"adventuring-gear","presentation":{"originalName":"Rations (1 day)","defaultLocale":"ko-KR","locales":{"ko-KR":{"name":"식량 (1일분)"}}},"mechanics":[{"kind":"consumable-definition","config":{}}]}]}