{"$schema":"https://simplevtt.local/schemas/rule-module.schema.json","schemaVersion":"0.1-draft","moduleId":"dnd.srd-5.2.1.spells-a-astral-projection","moduleVersion":"0.1-draft","rulesProfile":{"id":"dnd.srd-5.2.1","version":"0.1-draft"},"defaultLocale":"ko-KR","source":{"document":"System Reference Document","version":"5.2.1","license":"CC-BY-4.0","srdDerived":true},"dependencies":[{"moduleId":"dnd.srd-5.2.1.core","version":"0.1-draft"}],"conflicts":[],"capabilities":[],"extensionPoints":[],"content":[{"id":"dnd.srd521.spell.astral-projection","category":"spell","presentation":{"originalName":"Astral Projection","defaultLocale":"ko-KR","locales":{"ko-KR":{"name":"아스트랄체 투영"}}},"mechanics":[{"kind":"spell-definition","config":{"level":9,"school":"necromancy","ritual":false,"castingTimeText":"1시간","rangeText":"10피트","componentsText":"V, S, M (각 대상마다 1,000 GP 이상의 홍옥 하나와 100 GP 이상의 은괴 하나, 모두 주문이 소모)","durationText":"무효화될 때까지","supportStatus":"presentation-only","sourcePath":"10-RULEBOOKS/srd-5.2.1/spells/a.md"}}]}]}