{"$schema":"https://simplevtt.local/schemas/rule-module.schema.json","schemaVersion":"0.1-draft","moduleId":"dnd.srd-5.2.1.equipment-tools","moduleVersion":"0.1-draft","rulesProfile":{"id":"dnd.srd-5.2.1","version":"0.1-draft"},"defaultLocale":"ko-KR","source":{"document":"System Reference Document","version":"5.2.1","license":"CC-BY-4.0","srdDerived":true},"localizationSource":{"defaultLocale":"ko-KR","repository":"Kaetaeru/D-D-2024-","srdPathRoot":"10-RULEBOOKS/srd-5.2.1/equipment/tools.md","distributionBoundary":"srd-only"},"dependencies":[{"moduleId":"dnd.srd-5.2.1.core","version":"0.1-draft"}],"conflicts":[],"capabilities":[],"extensionPoints":[],"content":[{"id":"dnd.srd521.item.tool.alchemists-supplies","category":"tool","presentation":{"originalName":"Alchemist's Supplies","defaultLocale":"ko-KR","locales":{"ko-KR":{"name":"연금술사 도구"}}},"mechanics":[{"kind":"tool-definition","config":{"ability":"int","priceGp":50,"weightLb":8}}]},{"id":"dnd.srd521.item.tool.brewers-supplies","category":"tool","presentation":{"originalName":"Brewer's Supplies","defaultLocale":"ko-KR","locales":{"ko-KR":{"name":"양조 도구"}}},"mechanics":[{"kind":"tool-definition","config":{"ability":"int","priceGp":20,"weightLb":9}}]},{"id":"dnd.srd521.item.tool.calligraphers-supplies","category":"tool","presentation":{"originalName":"Calligrapher's Supplies","defaultLocale":"ko-KR","locales":{"ko-KR":{"name":"서예 도구"}}},"mechanics":[{"kind":"tool-definition","config":{"ability":"dex","priceGp":10,"weightLb":5}}]},{"id":"dnd.srd521.item.tool.carpenters-tools","category":"tool","presentation":{"originalName":"Carpenter's Tools","defaultLocale":"ko-KR","locales":{"ko-KR":{"name":"목수 도구"}}},"mechanics":[{"kind":"tool-definition","config":{"ability":"str","priceGp":8,"weightLb":6}}]},{"id":"dnd.srd521.item.tool.cartographers-tools","category":"tool","presentation":{"originalName":"Cartographer's Tools","defaultLocale":"ko-KR","locales":{"ko-KR":{"name":"지도 제작자 도구"}}},"mechanics":[{"kind":"tool-definition","config":{"ability":"wis","priceGp":15,"weightLb":6}}]},{"id":"dnd.srd521.item.tool.cobblers-tools","category":"tool","presentation":{"originalName":"Cobbler's Tools","defaultLocale":"ko-KR","locales":{"ko-KR":{"name":"제화공 도구"}}},"mechanics":[{"kind":"tool-definition","config":{"ability":"dex","priceGp":5,"weightLb":5}}]},{"id":"dnd.srd521.item.tool.cooks-utensils","category":"tool","presentation":{"originalName":"Cook's Utensils","defaultLocale":"ko-KR","locales":{"ko-KR":{"name":"요리 도구"}}},"mechanics":[{"kind":"tool-definition","config":{"ability":"wis","priceGp":1,"weightLb":8}}]},{"id":"dnd.srd521.item.tool.glassblowers-tools","category":"tool","presentation":{"originalName":"Glassblower's Tools","defaultLocale":"ko-KR","locales":{"ko-KR":{"name":"유리세공사 도구"}}},"mechanics":[{"kind":"tool-definition","config":{"ability":"int","priceGp":30,"weightLb":5}}]},{"id":"dnd.srd521.item.tool.jewelers-tools","category":"tool","presentation":{"originalName":"Jeweler's Tools","defaultLocale":"ko-KR","locales":{"ko-KR":{"name":"보석세공사 도구"}}},"mechanics":[{"kind":"tool-definition","config":{"ability":"int","priceGp":25,"weightLb":2}}]},{"id":"dnd.srd521.item.tool.leatherworkers-tools","category":"tool","presentation":{"originalName":"Leatherworker's Tools","defaultLocale":"ko-KR","locales":{"ko-KR":{"name":"가죽세공사 도구"}}},"mechanics":[{"kind":"tool-definition","config":{"ability":"dex","priceGp":5,"weightLb":5}}]},{"id":"dnd.srd521.item.tool.masons-tools","category":"tool","presentation":{"originalName":"Mason's Tools","defaultLocale":"ko-KR","locales":{"ko-KR":{"name":"석공 도구"}}},"mechanics":[{"kind":"tool-definition","config":{"ability":"str","priceGp":10,"weightLb":8}}]},{"id":"dnd.srd521.item.tool.painters-supplies","category":"tool","presentation":{"originalName":"Painter's Supplies","defaultLocale":"ko-KR","locales":{"ko-KR":{"name":"화가 도구"}}},"mechanics":[{"kind":"tool-definition","config":{"ability":"wis","priceGp":10,"weightLb":5}}]},{"id":"dnd.srd521.item.tool.potters-tools","category":"tool","presentation":{"originalName":"Potter's Tools","defaultLocale":"ko-KR","locales":{"ko-KR":{"name":"도공 도구"}}},"mechanics":[{"kind":"tool-definition","config":{"ability":"int","priceGp":10,"weightLb":3}}]},{"id":"dnd.srd521.item.tool.smiths-tools","category":"tool","presentation":{"originalName":"Smith's Tools","defaultLocale":"ko-KR","locales":{"ko-KR":{"name":"대장장이 도구"}}},"mechanics":[{"kind":"tool-definition","config":{"ability":"str","priceGp":20,"weightLb":8}}]},{"id":"dnd.srd521.item.tool.tinkers-tools","category":"tool","presentation":{"originalName":"Tinker's Tools","defaultLocale":"ko-KR","locales":{"ko-KR":{"name":"땜장이 도구"}}},"mechanics":[{"kind":"tool-definition","config":{"ability":"dex","priceGp":50,"weightLb":10}}]},{"id":"dnd.srd521.item.tool.weavers-tools","category":"tool","presentation":{"originalName":"Weaver's Tools","defaultLocale":"ko-KR","locales":{"ko-KR":{"name":"직조 도구"}}},"mechanics":[{"kind":"tool-definition","config":{"ability":"dex","priceGp":1,"weightLb":5}}]},{"id":"dnd.srd521.item.tool.woodcarvers-tools","category":"tool","presentation":{"originalName":"Woodcarver's Tools","defaultLocale":"ko-KR","locales":{"ko-KR":{"name":"목각 도구"}}},"mechanics":[{"kind":"tool-definition","config":{"ability":"dex","priceGp":1,"weightLb":5}}]},{"id":"dnd.srd521.item.tool.disguise-kit","category":"tool","presentation":{"originalName":"Disguise Kit","defaultLocale":"ko-KR","locales":{"ko-KR":{"name":"변장 도구"}}},"mechanics":[{"kind":"tool-definition","config":{"ability":"cha","priceGp":25,"weightLb":3}}]},{"id":"dnd.srd521.item.tool.forgery-kit","category":"tool","presentation":{"originalName":"Forgery Kit","defaultLocale":"ko-KR","locales":{"ko-KR":{"name":"위조 도구"}}},"mechanics":[{"kind":"tool-definition","config":{"ability":"dex","priceGp":15,"weightLb":5}}]},{"id":"dnd.srd521.item.tool.gaming-set","category":"tool","presentation":{"originalName":"Gaming Set","defaultLocale":"ko-KR","locales":{"ko-KR":{"name":"게임 도구"}}},"mechanics":[{"kind":"tool-definition","config":{"ability":"wis","variants":["dice","dragonchess","playing-cards","three-dragon-ante"],"variantGroup":"gaming-set","variantLabel":"alone","variantNames":{"dice":"주사위 세트","dragonchess":"드래곤체스 세트","playing-cards":"카드 세트","three-dragon-ante":"삼룡 앤티 세트"}}}]},{"id":"dnd.srd521.item.tool.herbalism-kit","category":"tool","presentation":{"originalName":"Herbalism Kit","defaultLocale":"ko-KR","locales":{"ko-KR":{"name":"약초학 도구"}}},"mechanics":[{"kind":"tool-definition","config":{"ability":"int","priceGp":5,"weightLb":3}}]},{"id":"dnd.srd521.item.tool.musical-instrument","category":"tool","presentation":{"originalName":"Musical Instrument","defaultLocale":"ko-KR","locales":{"ko-KR":{"name":"악기"}}},"mechanics":[{"kind":"tool-definition","config":{"ability":"cha","variants":["bagpipes","drum","dulcimer","flute","horn","lute","lyre","pan-flute","shawm","viol"],"variantGroup":"instrument","variantLabel":"alone","variantNames":{"bagpipes":"백파이프","drum":"북","dulcimer":"덜시머","flute":"플루트","horn":"호른","lute":"류트","lyre":"리라","pan-flute":"팬플루트","shawm":"숌","viol":"비올"}}}]},{"id":"dnd.srd521.item.tool.navigators-tools","category":"tool","presentation":{"originalName":"Navigator's Tools","defaultLocale":"ko-KR","locales":{"ko-KR":{"name":"항해사 도구"}}},"mechanics":[{"kind":"tool-definition","config":{"ability":"wis","priceGp":25,"weightLb":2}}]},{"id":"dnd.srd521.item.tool.poisoners-kit","category":"tool","presentation":{"originalName":"Poisoner's Kit","defaultLocale":"ko-KR","locales":{"ko-KR":{"name":"독 제작자 도구"}}},"mechanics":[{"kind":"tool-definition","config":{"ability":"int","priceGp":50,"weightLb":2}}]},{"id":"dnd.srd521.item.tool.thieves-tools","category":"tool","presentation":{"originalName":"Thieves' Tools","defaultLocale":"ko-KR","locales":{"ko-KR":{"name":"도둑 도구"}}},"mechanics":[{"kind":"tool-definition","config":{"ability":"dex","priceGp":25,"weightLb":1}}]}]}