{"$schema":"https://simplevtt.local/schemas/rule-module.schema.json","schemaVersion":"0.1-draft","moduleId":"dnd.srd-5.2.1.feat-common-play","moduleVersion":"0.1-draft","rulesProfile":{"id":"dnd.srd-5.2.1","version":"0.1-draft"},"defaultLocale":"ko-KR","source":{"document":"System Reference Document","version":"5.2.1","license":"CC-BY-4.0","srdDerived":true},"dependencies":[{"moduleId":"dnd.srd-5.2.1.feats","version":"0.1-draft"}],"conflicts":[],"capabilities":["dnd.effect.property-modify.v1"],"extensionPoints":[],"content":[{"id":"effect.feat.combat-prowess","category":"option","presentation":{"originalName":"전투 기량의 은총","defaultLocale":"ko-KR","locales":{"ko-KR":{"name":"전투 기량의 은총","summary":"빗나간 공격 굴림을 20으로 바꿉니다 (턴당 한 번)"}}},"tags":["feat","common-play","srd-5.2.1"],"mechanics":[{"kind":"common-play","config":{"$schema":"https://simplevtt.local/schemas/common-play-contract.schema.json","schemaVersion":"0.2-draft","id":"feat:epic.combat-prowess","interceptors":[{"id":"combat-prowess-d20","timing":"d20.outcome-determined","operation":"recalculate","slot":"d20.roll","families":["attack-roll"],"outcomes":["failure"],"interaction":{"id":"use","kind":"choice","responder":"actor-owner","mode":"blocking","input":{"type":"boolean"},"revalidate":"if-revision-changed","stalePolicy":"reject"},"operations":[{"kind":"roll.modify","mode":"set-die","value":20}]}],"entryPoints":[{"id":"rule","invocation":"manual","operations":[{"kind":"adjudication.request","question":"턴당 한 번 — 빗나간 공격을 카드에서 되살립니다"}]}]}}]},{"id":"effect.feat.fate","category":"option","presentation":{"originalName":"운명의 은총","defaultLocale":"ko-KR","locales":{"ko-KR":{"name":"운명의 은총","summary":"판정에 2d4를 더합니다 (짧은 휴식마다 한 번)"}}},"tags":["feat","common-play","srd-5.2.1"],"mechanics":[{"kind":"common-play","config":{"$schema":"https://simplevtt.local/schemas/common-play-contract.schema.json","schemaVersion":"0.2-draft","id":"feat:epic.fate","payments":[{"kind":"resource","resource":"resource:feat.fate","amount":{"value":1},"consumeAt":"commit"}],"interceptors":[{"id":"fate-d20","timing":"d20.outcome-determined","operation":"recalculate","slot":"d20.roll","families":[],"outcomes":["failure"],"interaction":{"id":"use","kind":"choice","responder":"actor-owner","mode":"blocking","input":{"type":"boolean"},"revalidate":"if-revision-changed","stalePolicy":"reject"},"operations":[{"kind":"roll.modify","mode":"add-die","dice":"2d4"}]}],"entryPoints":[{"id":"rule","invocation":"manual","operations":[{"kind":"resource.change","resource":"resource:feat.fate","amount":-1,"target":"self"},{"kind":"adjudication.request","question":"60ft 안의 다른 이의 판정에 쓰려면 표에서 선언하세요"}]}]}}]},{"id":"effect.feat.irresistible-offense","category":"option","presentation":{"originalName":"저항할 수 없는 공격의 은총","defaultLocale":"ko-KR","locales":{"ko-KR":{"name":"저항할 수 없는 공격의 은총","summary":"자신의 무기·맨손 피해가 저항을 무시합니다"}}},"tags":["feat","common-play","srd-5.2.1"],"mechanics":[{"kind":"common-play","config":{"$schema":"https://simplevtt.local/schemas/common-play-contract.schema.json","schemaVersion":"0.2-draft","id":"feat:epic.irresistible-offense","entryPoints":[{"id":"rule","invocation":"manual","operations":[{"kind":"property.modify","property":"damage.ignore-resistance","operation":"add","value":"타격"},{"kind":"property.modify","property":"damage.ignore-resistance","operation":"add","value":"관통"},{"kind":"property.modify","property":"damage.ignore-resistance","operation":"add","value":"참격"}]}],"interceptors":[{"id":"overwhelming-strike","timing":"attack.resolved","slot":"attack.outcome","outcomes":["crit"],"operations":[{"kind":"damage.apply","amount":{"ref":"ability.str.score"},"damageType":"weapon","target":"attack-target"}]}]}}]},{"id":"effect.feat.grappler","category":"option","presentation":{"originalName":"붙잡기 전문가","defaultLocale":"ko-KR","locales":{"ko-KR":{"name":"붙잡기 전문가","summary":"붙잡기와 관련된 세 가지 — 표에서 판단"}}},"tags":["feat","common-play","srd-5.2.1"],"mechanics":[{"kind":"common-play","config":{"$schema":"https://simplevtt.local/schemas/common-play-contract.schema.json","schemaVersion":"0.2-draft","id":"feat:grappler","entryPoints":[{"id":"rule","invocation":"manual","operations":[{"kind":"adjudication.request","question":"맨손 타격이 명중하면 붙잡기를 함께 시도 (턴당 한 번)"},{"kind":"adjudication.request","question":"자신이 붙잡은 생물을 향한 공격 굴림에 유리"},{"kind":"adjudication.request","question":"붙잡은 생물을 끌고 가도 이동 속도가 절반이 되지 않음 (자신 이하 크기)"}]}]}}]},{"id":"effect.feat.night-spirit","category":"option","presentation":{"originalName":"밤의 영혼의 은총","defaultLocale":"ko-KR","locales":{"ko-KR":{"name":"밤의 영혼의 은총","summary":"약한 빛이나 어둠 속에서 투명해지고 모든 피해에 저항"}}},"tags":["feat","common-play","srd-5.2.1"],"mechanics":[{"kind":"common-play","config":{"$schema":"https://simplevtt.local/schemas/common-play-contract.schema.json","schemaVersion":"0.2-draft","id":"feat:epic.night-spirit","entryPoints":[{"id":"rule","invocation":"manual","operations":[{"kind":"adjudication.request","question":"약한 빛이나 어둠 속에 있는지는 표가 정합니다 — 그때 추가 행동으로 투명"},{"kind":"adjudication.request","question":"그림자 형상인 동안 광휘 외 모든 피해에 저항, 이동 속도 두 배"}]}]}}]}]}