{"$schema":"https://simplevtt.local/schemas/rule-module.schema.json","schemaVersion":"0.1-draft","moduleId":"dnd.srd-5.2.1.equipment-armor","moduleVersion":"0.1-draft","rulesProfile":{"id":"dnd.srd-5.2.1","version":"0.1-draft"},"defaultLocale":"ko-KR","source":{"document":"System Reference Document","version":"5.2.1","license":"CC-BY-4.0","srdDerived":true},"localizationSource":{"defaultLocale":"ko-KR","repository":"Kaetaeru/D-D-2024-","srdPathRoot":"10-RULEBOOKS/srd-5.2.1/equipment/","distributionBoundary":"srd-only"},"capabilities":["dnd.ac-formula-candidate.v1"],"content":[{"id":"dnd.srd521.item.armor.padded","category":"armor","presentation":{"originalName":"Padded Armor","defaultLocale":"ko-KR","locales":{"ko-KR":{"name":"누비 갑옷"}}},"mechanics":[{"kind":"armor-definition","config":{"training":"light","ac":{"base":11,"dex":"full"},"stealthDisadvantage":true}}]},{"id":"dnd.srd521.item.armor.leather","category":"armor","presentation":{"originalName":"Leather Armor","defaultLocale":"ko-KR","locales":{"ko-KR":{"name":"가죽 갑옷"}}},"mechanics":[{"kind":"armor-definition","config":{"training":"light","ac":{"base":11,"dex":"full"}}}]},{"id":"dnd.srd521.item.armor.studded-leather","category":"armor","presentation":{"originalName":"Studded Leather Armor","defaultLocale":"ko-KR","locales":{"ko-KR":{"name":"징 박힌 가죽 갑옷"}}},"mechanics":[{"kind":"armor-definition","config":{"training":"light","ac":{"base":12,"dex":"full"}}}]},{"id":"dnd.srd521.item.armor.hide","category":"armor","presentation":{"originalName":"Hide Armor","defaultLocale":"ko-KR","locales":{"ko-KR":{"name":"생가죽 갑옷"}}},"mechanics":[{"kind":"armor-definition","config":{"training":"medium","ac":{"base":12,"dexMax":2}}}]},{"id":"dnd.srd521.item.armor.chain-shirt","category":"armor","presentation":{"originalName":"Chain Shirt","defaultLocale":"ko-KR","locales":{"ko-KR":{"name":"사슬 셔츠"}}},"mechanics":[{"kind":"armor-definition","config":{"training":"medium","ac":{"base":13,"dexMax":2}}}]},{"id":"dnd.srd521.item.armor.scale-mail","category":"armor","presentation":{"originalName":"Scale Mail","defaultLocale":"ko-KR","locales":{"ko-KR":{"name":"비늘 갑옷"}}},"mechanics":[{"kind":"armor-definition","config":{"training":"medium","ac":{"base":14,"dexMax":2},"stealthDisadvantage":true}}]},{"id":"dnd.srd521.item.armor.breastplate","category":"armor","presentation":{"originalName":"Breastplate","defaultLocale":"ko-KR","locales":{"ko-KR":{"name":"흉갑"}}},"mechanics":[{"kind":"armor-definition","config":{"training":"medium","ac":{"base":14,"dexMax":2}}}]},{"id":"dnd.srd521.item.armor.half-plate","category":"armor","presentation":{"originalName":"Half Plate Armor","defaultLocale":"ko-KR","locales":{"ko-KR":{"name":"반판금 갑옷"}}},"mechanics":[{"kind":"armor-definition","config":{"training":"medium","ac":{"base":15,"dexMax":2},"stealthDisadvantage":true}}]},{"id":"dnd.srd521.item.armor.ring-mail","category":"armor","presentation":{"originalName":"Ring Mail","defaultLocale":"ko-KR","locales":{"ko-KR":{"name":"고리 갑옷"}}},"mechanics":[{"kind":"armor-definition","config":{"training":"heavy","ac":{"base":14},"stealthDisadvantage":true}}]},{"id":"dnd.srd521.item.armor.chain-mail","category":"armor","presentation":{"originalName":"Chain Mail","defaultLocale":"ko-KR","locales":{"ko-KR":{"name":"사슬 갑옷"}}},"mechanics":[{"kind":"armor-definition","config":{"training":"heavy","ac":{"base":16},"strengthRequirement":13,"stealthDisadvantage":true}}]},{"id":"dnd.srd521.item.armor.splint","category":"armor","presentation":{"originalName":"Splint Armor","defaultLocale":"ko-KR","locales":{"ko-KR":{"name":"철편 갑옷"}}},"mechanics":[{"kind":"armor-definition","config":{"training":"heavy","ac":{"base":17},"strengthRequirement":15,"stealthDisadvantage":true}}]},{"id":"dnd.srd521.item.armor.plate","category":"armor","presentation":{"originalName":"Plate Armor","defaultLocale":"ko-KR","locales":{"ko-KR":{"name":"판금 갑옷"}}},"mechanics":[{"kind":"armor-definition","config":{"training":"heavy","ac":{"base":18},"strengthRequirement":15,"stealthDisadvantage":true}}]},{"id":"dnd.srd521.item.shield","category":"shield","presentation":{"originalName":"Shield","defaultLocale":"ko-KR","locales":{"ko-KR":{"name":"방패"}}},"mechanics":[{"kind":"shield-definition","config":{"training":"shield","acBonus":2,"equipEconomy":"utilize"}}]}]}